<!ELEMENT tablaEsperanzaDeVida (tabla+)>
<!ELEMENT tabla (region, pais, esperanzaVida)>
    <!ATTLIST tabla  id ID #REQUIRED>
<!ELEMENT region (#PCDATA)>
<!ELEMENT pais (#PCDATA)>
<!ELEMENT esperanzaVida (#PCDATA)>
